{
    "type": "2d",
    "start-state": "step1",
    "blank-symbol": " ",

    "states": {
        "step1": {
            " ": ["R", "step2", "."],
            ".": ["R", "step2", " "]
        },
        "step2": {
            " ": ["D", "step3", "."],
            ".": ["D", "step3", " "]
        },
        "step3": {
            " ": ["L", "step4", "."],
            ".": ["L", "step4", " "]
        },
        "step4": {
            " ": ["U", "step1", "."],
            ".": ["U", "step1", " "]
        }
    },

    "inputs": [
        {
            "tape": [
                " .",
                ". "
            ]
        }
    ]
}
