{
    "type": "2d",
    "start-state": "go(R)",
    "blank-symbol": " ",

    "states": {
        "go(R)": {
            ".": ["R", "go(D)", " "],
            " ": ["R", "go(D)", "."]
        },
        "go(D)": {
            ".": ["D", "go(R)", " "],
            " ": ["D", "go(R)", "."]
        }
    },

    "inputs": [
        {
            "tape": []
        }
    ]
}
